{
  "productName": "Platform.Bible",
  "appId": "org.paranext.PlatformBible",
  "copyright": "Copyright (c) 2022-2024 SIL International",
  "electronBuilderPublish": {
    "provider": "github",
    "owner": "paranext",
    "repo": "paranext"
  },
  "build": {
    "coreRepo": {
      "uri": "https://github.com/paranext/paranext-core.git"
    },
    "extensionRepos": [
      { "uri": "https://github.com/paranext/platform-bible-sample-extensions.git" }
    ]
  }
}
